{
  "schema_id": "dd-eval/run-profile@1",
  "id": "e2e-server-merge-grok-4-7-high",
  "case_id": "sdlc-eval-2026-summer-task-priority",
  "operational_decision": {
    "schema_id": "run-operational-decision@1",
    "id": "task-priority-scored-local-retain",
    "settings": {
      "merge_delivery": {
        "strategy": "local"
      },
      "merge_cleanup": {
        "source": "retain"
      }
    },
    "policy": {
      "path": ".memory-bank/project-policy.md",
      "sha256": "cc0f1730de1729ffed8dd34fae3bed1716343d518934b4fe291270dc54faf982",
      "clauses": [
        "Git branch strategy",
        "Cleanup feature worktree"
      ]
    },
    "acceptance": {
      "source": "run-profile-launch",
      "reference": "e2e-server-merge-grok-4-7-high"
    },
    "exception": {
      "reason": "Scored E2E uses local target integration without remote push/tag/deploy; retain the execution-owned source checkout for frozen evidence and investigation.",
      "owner": "EVAL run-profile operator",
      "review_at": "2026-11-20"
    }
  },
  "subject": {
    "profile_id": "grok-acp-xai-grok-4-7-high"
  },
  "selection": {
    "focused_stages": [],
    "segment": null,
    "e2e": true,
    "repetitions": 1
  },
  "judge": {
    "enabled": true,
    "profile_id": "codex-desktop-gpt-6-1-sol-high"
  },
  "interaction_judge": {
    "profile_id": "codex-desktop-gpt-6-1-sol-high",
    "verdict_contract": "dd-eval/hitl-coverage@1"
  },
  "concurrency": {
    "global": 1,
    "per_harness": {
      "grok-acp": 1,
      "codex-desktop": 1
    }
  },
  "failure_policy": {
    "stop_run_on_infrastructure_error": true,
    "stop_execution_on_unexpected_hitl": true,
    "stop_execution_on_unmatched_hitl": true
  }
}
